{"scenario":"Generic type aliases and incremental compiler","selected_lenses":["compiler-and-language","distributed-and-concurrent","data-and-migration"],"material_ambiguities":[{"id":"AR-01","question":"What is the complete grammar for alias declarations and uses, including parameter lists, arity, duplicate parameters, constraints, partial application, and malformed-syntax recovery?","impact":["parser and AST changes","syntax diagnostics","conformance tests"],"must_block":true},{"id":"AR-02","question":"Which namespace contains aliases, and what are the rules for visibility, exports, imports, shadowing, duplicate declarations, and collisions with other type names?","impact":["name resolution","module interfaces","compatibility"],"must_block":true},{"id":"AR-03","question":"Are forward references limited to the same module, and how should references across modules and module-import cycles behave?","impact":["declaration collection order","module dependency analysis","cycle detection"],"must_block":true},{"id":"AR-04","question":"Are aliases fully transparent for type identity and equivalence, or does alias identity remain observable anywhere?","impact":["type equality","subtyping and inference","diagnostics","typed IR"],"must_block":true},{"id":"AR-05","question":"What substitution and name-capture rules apply to generic parameters, nested aliases, shadowed names, and aliases used with the wrong number of arguments?","impact":["expansion algorithm","type correctness","error behavior"],"must_block":true},{"id":"AR-06","question":"Precisely which recursive aliases are valid: direct versus mutual recursion, and what condition makes recursion “useful” rather than infinitely expanding?","impact":["language semantics","termination analysis","valid-program classification"],"must_block":true},{"id":"AR-07","question":"What finite representation should valid recursive aliases use after expansion, and can the existing typed IR represent that recursion without infinite materialization?","impact":["expansion representation","IR invariants","lowering architecture"],"must_block":true},{"id":"AR-08","question":"At what exact compiler phase are alias names resolved, cycles classified, and aliases expanded relative to inference, type checking, and IR lowering?","impact":["compiler pipeline ordering","error recovery","pass interfaces"],"must_block":true},{"id":"AR-09","question":"When an alias body is invalid, unresolved, or recursively non-terminating, should compilation stop, produce an error type, or continue with bounded recovery?","impact":["failure semantics","cascading diagnostics","downstream pass safety"],"must_block":true},{"id":"AR-10","question":"What must each diagnostic report for unresolved aliases, arity errors, duplicate declarations, invalid recursion, and cycles: primary span, related spans, expansion chain, severity, and stable code?","impact":["diagnostic contract","IDE and machine-readable tooling","golden tests"],"must_block":true},{"id":"AR-11","question":"What resource limits apply to expansion depth, alias graph size, instantiated type size, and diagnostic chain length?","impact":["termination guarantees","compile-time performance","denial-of-service resistance"],"must_block":true},{"id":"AR-12","question":"What does “cached by alias name” mean when aliases are module-scoped and generic: is the key qualified by module identity, type arguments, compiler options, and source/version identity?","impact":["cache correctness","collision prevention","generic instantiation behavior"],"must_block":true},{"id":"AR-13","question":"What dependency information must be recorded so changing an alias, a referenced alias, an import, or relevant compiler configuration invalidates every transitive cached expansion?","impact":["incremental correctness","dependency graph","stale-result prevention"],"must_block":true},{"id":"AR-14","question":"Is the cache process-local or durable, and can compilation workers access it concurrently?","impact":["serialization requirements","synchronization and atomicity","failure recovery"],"must_block":true},{"id":"AR-15","question":"If cache access is concurrent or durable, what are the consistency, atomic publication, corruption detection, cancellation, and rebuild rules?","impact":["race prevention","crash safety","deterministic compilation"],"must_block":true},{"id":"AR-16","question":"What compatibility boundary is promised for existing modules: source code, compiled module artifacts, typed IR, public ABI, incremental caches, or all of these?","impact":["acceptance criteria","format-version strategy","migration scope"],"must_block":true},{"id":"AR-17","question":"Must old and new compiler versions or artifacts interoperate during a mixed-version window, and what are the upgrade, cache-invalidation, rollback, and unsupported-version behaviors?","impact":["artifact evolution","deployment and rollback","migration verification"],"must_block":true},{"id":"AR-18","question":"Should expanded aliases preserve source provenance or alias-expansion metadata in typed IR for diagnostics and tooling, or be indistinguishable from directly written types?","impact":["IR schema","diagnostic source mapping","debugger and language-server behavior"],"must_block":true},{"id":"AR-19","question":"What observable performance and determinism requirements must incremental and clean compilation satisfy, including cache-hit expectations and output equivalence?","impact":["non-functional acceptance criteria","benchmark design","incremental-versus-clean verification"],"must_block":true},{"id":"AR-20","question":"Which tooling surfaces must understand generic aliases—formatter, language server, symbol navigation, rename, documentation, and serialized compiler APIs?","impact":["feature scope","public integration contracts","compatibility testing"],"must_block":true}],"gate_verdict":"BLOCK"}