{"scenario":"multi-currency transfer ledger","selected_lenses":["financial-system","distributed-and-concurrent","data-and-migration","web-application"],"material_ambiguities":[{"id":"AR-01","question":"What ledger model, account types, posting entries, balancing equation, and immutable-history rules govern transfers?","impact":["Data model","Posting implementation","Integrity tests","Audit reconstruction"],"must_block":true},{"id":"AR-02","question":"When are funds checked, reserved, debited, credited, and released; are overdrafts or negative balances permitted?","impact":["Concurrency control","Available-balance calculation","Failure recovery","Customer-visible balances"],"must_block":true},{"id":"AR-03","question":"Which currencies are supported, and what minor units, internal precision, rounding mode, residual treatment, and overflow limits apply?","impact":["Amount representation","Conversion calculations","Ledger balancing","Boundary validation"],"must_block":true},{"id":"AR-04","question":"Which exchange-rate provider and rate type apply, when is the rate captured, how long is it valid, and is it guaranteed or requoted before posting?","impact":["FX integration","Displayed amount","Settlement amount","Historical reproducibility"],"must_block":true},{"id":"AR-05","question":"What happens when the rate provider is unavailable, stale, inconsistent, or later corrects a rate?","impact":["Submission availability","Retry behavior","Correction workflow","Customer liability"],"must_block":true},{"id":"AR-06","question":"How is the configurable fee defined: payer, calculation base, currency, rounding order, minimum/maximum, taxes, and configuration scope/effective time?","impact":["Posting entries","Quoted totals","Configuration model","Reconciliation"],"must_block":true},{"id":"AR-07","question":"Which displayed converted amount is authoritative—indicative, locked, or final—and how must the client represent later changes or failure?","impact":["API response contract","UI states","Customer expectations","Dispute handling"],"must_block":true},{"id":"AR-08","question":"What is the complete transfer state machine, including permitted transitions among submitted, pending, reserved, debited, credited, completed, failed, cancelled, refunded, and reconciled states?","impact":["Workflow implementation","API behavior","Audit events","State-transition tests"],"must_block":true},{"id":"AR-09","question":"Which state changes and ledger postings must be atomic, and what observable state remains after failure before, during, or after each posting?","impact":["Transaction boundaries","Compensation design","Balance correctness","Recovery procedures"],"must_block":true},{"id":"AR-10","question":"What idempotency key contract applies, including ownership, scope, retention window, payload mismatch handling, and replayed response behavior?","impact":["Duplicate prevention","API validation","Storage constraints","Retry safety"],"must_block":true},{"id":"AR-11","question":"What queue delivery and ordering guarantees are required, and how are duplicate, reordered, delayed, expired, and poison messages handled?","impact":["Consumer design","Deduplication","Dead-letter recovery","Correctness under replay"],"must_block":true},{"id":"AR-12","question":"After a client timeout or worker crash with an unknown outcome, how does a client or operator discover the authoritative result and safely retry?","impact":["Status API","Correlation identifiers","Retry protocol","Support diagnostics"],"must_block":true},{"id":"AR-13","question":"How are concurrent transfers, cancellations, refunds, and balance reads serialized, and what consistency may clients observe while postings are pending?","impact":["Isolation and locking","Race prevention","Read semantics","Insufficient-funds handling"],"must_block":true},{"id":"AR-14","question":"Who may cancel, until which exact commit point, and what wins when cancellation races with debit, credit, retry, or completion?","impact":["Authorization","State machine","Queue coordination","Compensation behavior"],"must_block":true},{"id":"AR-15","question":"What financial effect does cancellation have on reserved funds, fees, FX exposure, and already-created ledger entries?","impact":["Reversal postings","Fee treatment","FX liability","Audit history"],"must_block":true},{"id":"AR-16","question":"What does a refund mean financially: full or partial, who may initiate it, which rate applies, who bears FX differences, and are fees returned?","impact":["Refund API","Ledger entries","Permissions","Reconciliation and reporting"],"must_block":true},{"id":"AR-17","question":"What limits, approvals, sanctions/compliance checks, and segregation-of-duties rules apply to transfers, cancellations, refunds, and manual repairs?","impact":["Authorization model","Workflow gates","Operational tooling","Regulatory compliance"],"must_block":true},{"id":"AR-18","question":"Which jurisdictions, regulatory regimes, data-residency rules, and reporting obligations are in scope?","impact":["Product scope","Data placement","Retention","Compliance controls"],"must_block":true},{"id":"AR-19","question":"What are the external settlement system's responsibilities and contract, and when is an internal transfer considered settled versus merely completed?","impact":["State definitions","Integration boundary","Customer reporting","Reconciliation semantics"],"must_block":true},{"id":"AR-20","question":"What is the settlement-file contract: format, currency and amount conventions, identifiers, timezone/business date, delivery cutoff, authentication, encryption, and versioning?","impact":["Importer design","Validation","Security","Daily scheduling"],"must_block":true},{"id":"AR-21","question":"How are missing, duplicate, malformed, partial, late, corrected, or replayed settlement files and records processed?","impact":["Import idempotency","Partial-failure handling","Operational recovery","Settlement accuracy"],"must_block":true},{"id":"AR-22","question":"How are settlement records matched, what tolerances are allowed, and how are unmatched or mismatched items classified, escalated, disputed, and repaired?","impact":["Matching algorithm","Exception workflow","Repair authority","Reconciliation reporting"],"must_block":true},{"id":"AR-23","question":"Which audit events, values, provenance, actor identities, correlations, and before/after states must be recorded, and who may access them?","impact":["Audit schema","Observability","Privacy controls","Forensic reconstruction"],"must_block":true},{"id":"AR-24","question":"What effective, event, posting, settlement, and reconciliation timestamps are required, with which timezone, clock, business-day, close-period, and backdating rules?","impact":["Ordering","Reporting periods","Reconciliation","Historical queries"],"must_block":true},{"id":"AR-25","question":"What authentication model and actor/action/resource authorization matrix governs customer, service, support, finance, and administrator access?","impact":["API security","Tenant isolation","Administrative exceptions","Security testing"],"must_block":true},{"id":"AR-26","question":"What API contracts are required for submission, status, cancellation, and refund, including validation, errors, versioning, rate limits, and stale/concurrent responses?","impact":["Client integration","Server validation","Retry behavior","Compatibility testing"],"must_block":true},{"id":"AR-27","question":"What sensitive-data classification, encryption, masking, retention, deletion, backup, restore, and audit-retention rules apply?","impact":["Storage design","Access controls","Disaster recovery","Compliance"],"must_block":true},{"id":"AR-28","question":"What transaction volumes, concurrency, latency, availability, queue-delay, reconciliation-window, RTO, and RPO targets must the platform satisfy?","impact":["Architecture sizing","Backpressure","Service-level verification","Recovery design"],"must_block":true},{"id":"AR-29","question":"Is this a greenfield ledger or an integration/migration involving existing accounts, balances, transfers, identifiers, or historical records; if existing data is involved, what cutover and validation rules apply?","impact":["Scope","Data migration","Compatibility","Balance initialization"],"must_block":true},{"id":"AR-30","question":"Who has authoritative repair power after posting or reconciliation errors, and must corrections use reversals, compensating entries, restatements, or another controlled mechanism?","impact":["Immutable-history rules","Operational controls","Financial reporting","Auditability"],"must_block":true}],"gate_verdict":"BLOCK"}